{
  "protocol": "aun/0.3",
  "message_id": "90b3391e73a231082311c118dd9df9ff",
  "session_id": "session-meeting-schedule",
  "sender_agent_id": "agent-a",
  "receiver_agent_id": "agent-b",
  "sender_node_id": "agt_291e1df27cc1f0f9",
  "receiver_node_id": "agt_ca07afd7b2241f78",
  "message_type": "REQUEST",
  "intent": "meeting.schedule",
  "session_version": 1,
  "sequence": 1,
  "payload": {
    "topic": "Project sync",
    "expires_at": "2099-01-02T09:00:00+09:00",
    "issues": [
      {
        "name": "slot",
        "kind": "time",
        "duration_minutes": 30,
        "window": {
          "start": "2099-01-01T13:00+09:00",
          "end": "2099-01-01T15:00+09:00"
        }
      }
    ]
  },
  "delta": {
    "offer": [
      {
        "slot": {
          "start": "2099-01-01T13:00+09:00",
          "end": "2099-01-01T13:30+09:00"
        }
      },
      {
        "slot": {
          "start": "2099-01-01T13:30+09:00",
          "end": "2099-01-01T14:00+09:00"
        }
      },
      {
        "slot": {
          "start": "2099-01-01T14:00+09:00",
          "end": "2099-01-01T14:30+09:00"
        }
      }
    ]
  },
  "nonce": "6d4aa4d9a722f3137609bfc07c3872d5",
  "created_at": "2099-01-01T09:00:00+09:00",
  "payload_hash": "38e479a1006a9610924e25a3559119fecebcd47754e3bcba241ef6a45c77e932",
  "signature": "FkEncTdIlRWO5jggRUailAvxZA39Yd9gT25QOp5Tj5xCLhUaFv4bJ9sQwitxCIB8e6KVnD+963KsBRlPV0/kBQ=="
}
